{
  "$schema": "./service-schema.json",
  "serviceType": "generic",
  "ircdType": "hybrid",
  "version": "1.0.0",
  "services": {},
  "ircd": {
    "userModes": [
      {
        "mode": "i",
        "name": "invisible",
        "description": "Invisible"
      },
      {
        "mode": "w",
        "name": "wallops",
        "description": "Wallops"
      },
      {
        "mode": "g",
        "name": "callerid",
        "description": "Caller ID"
      },
      {
        "mode": "d",
        "name": "deaf",
        "description": "Deaf"
      },
      {
        "mode": "D",
        "name": "privdeaf",
        "description": "Privdeaf"
      },
      {
        "mode": "x",
        "name": "cloak",
        "description": "Cloaked host"
      },
      {
        "mode": "z",
        "name": "sslooms",
        "description": "SSL only msgs"
      },
      {
        "mode": "r",
        "name": "registered",
        "description": "Registered"
      },
      {
        "mode": "B",
        "name": "bot",
        "description": "Bot"
      },
      {
        "mode": "a",
        "name": "hideidle",
        "description": "Hide idle"
      },
      {
        "mode": "I",
        "name": "hidechans",
        "description": "Hide channels"
      },
      {
        "mode": "L",
        "name": "noredirect",
        "description": "No redirect"
      },
      {
        "mode": "R",
        "name": "regonlymsg",
        "description": "Reg only PM"
      },
      {
        "mode": "S",
        "name": "stripbad",
        "description": "Strip bad"
      },
      {
        "mode": "Z",
        "name": "sslsendsonly",
        "description": "SSL sends only",
        "operOnly": true
      },
      {
        "mode": "o",
        "name": "oper",
        "description": "Oper",
        "operOnly": true
      }
    ],
    "channelModes": [
      {
        "mode": "b",
        "type": "list",
        "name": "ban",
        "description": "Ban"
      },
      {
        "mode": "e",
        "type": "list",
        "name": "except",
        "description": "Exception"
      },
      {
        "mode": "I",
        "type": "list",
        "name": "invex",
        "description": "Invite exception"
      },
      {
        "mode": "i",
        "type": "set",
        "name": "inviteonly",
        "description": "Invite only"
      },
      {
        "mode": "m",
        "type": "set",
        "name": "moderated",
        "description": "Moderated"
      },
      {
        "mode": "n",
        "type": "set",
        "name": "noexternal",
        "description": "No external"
      },
      {
        "mode": "p",
        "type": "set",
        "name": "private",
        "description": "Private"
      },
      {
        "mode": "s",
        "type": "set",
        "name": "secret",
        "description": "Secret"
      },
      {
        "mode": "t",
        "type": "set",
        "name": "topiclock",
        "description": "Topic lock"
      },
      {
        "mode": "r",
        "type": "set",
        "name": "registered",
        "description": "Registered"
      },
      {
        "mode": "c",
        "type": "set",
        "name": "blockcolor",
        "description": "Block colors"
      },
      {
        "mode": "C",
        "type": "set",
        "name": "noctcp",
        "description": "No CTCP"
      },
      {
        "mode": "z",
        "type": "set",
        "name": "sslonly",
        "description": "SSL only"
      },
      {
        "mode": "M",
        "type": "set",
        "name": "regmoderated",
        "description": "Reg moderated"
      },
      {
        "mode": "R",
        "type": "set",
        "name": "regonjoin",
        "description": "Reg only join"
      },
      {
        "mode": "N",
        "name": "nonickchange",
        "description": "No nick changes",
        "type": "set"
      },
      {
        "mode": "Q",
        "type": "set",
        "name": "nokick",
        "description": "No kick"
      },
      {
        "mode": "S",
        "type": "set",
        "name": "stripcolor",
        "description": "Strip colors"
      },
      {
        "mode": "T",
        "type": "set",
        "name": "nonotice",
        "description": "No notices"
      },
      {
        "mode": "K",
        "type": "set",
        "name": "noknock",
        "description": "No knock"
      },
      {
        "mode": "O",
        "type": "set",
        "name": "operonly",
        "description": "Oper only"
      },
      {
        "mode": "P",
        "type": "set",
        "name": "permanent",
        "description": "Permanent"
      },
      {
        "mode": "A",
        "type": "set",
        "name": "allowinvite",
        "description": "Allow invites"
      },
      {
        "mode": "B",
        "type": "param",
        "name": "anticaps",
        "description": "Anti-caps"
      },
      {
        "mode": "E",
        "type": "param",
        "name": "repeatblock",
        "description": "Repeat block"
      },
      {
        "mode": "f",
        "type": "param",
        "name": "flood",
        "description": "Flood"
      },
      {
        "mode": "F",
        "type": "param",
        "name": "nickflood",
        "description": "Nick flood"
      },
      {
        "mode": "H",
        "type": "param",
        "name": "history",
        "description": "History"
      },
      {
        "mode": "J",
        "type": "param",
        "name": "norejoin",
        "description": "No rejoin"
      },
      {
        "mode": "L",
        "type": "param",
        "name": "redirect",
        "description": "Redirect"
      },
      {
        "mode": "k",
        "type": "param",
        "name": "key",
        "description": "Key"
      },
      {
        "mode": "l",
        "type": "param",
        "name": "limit",
        "description": "Limit"
      },
      {
        "mode": "v",
        "type": "prefix",
        "prefix": "+",
        "name": "voice",
        "description": "Voice"
      },
      {
        "mode": "o",
        "type": "prefix",
        "prefix": "@",
        "name": "op",
        "description": "Op"
      }
    ],
    "commands": [
      {
        "name": "OPER",
        "description": "Become oper",
        "usage": "OPER <user> <pass>",
        "operOnly": false
      },
      {
        "name": "REHASH",
        "description": "Rehash",
        "usage": "REHASH",
        "operOnly": true
      },
      {
        "name": "RESTART",
        "description": "Restart",
        "usage": "RESTART",
        "operOnly": true
      },
      {
        "name": "DIE",
        "description": "Die",
        "usage": "DIE",
        "operOnly": true
      },
      {
        "name": "KILL",
        "description": "Kill",
        "usage": "KILL <nick> :<reason>",
        "operOnly": true
      },
      {
        "name": "KLINE",
        "description": "Kline",
        "usage": "KLINE <mask> [time] :<reason>",
        "operOnly": true
      },
      {
        "name": "DLINE",
        "description": "Dline",
        "usage": "DLINE <ip> [time] :<reason>",
        "operOnly": true
      },
      {
        "name": "XLINE",
        "description": "Xline",
        "usage": "XLINE <mask> [time] :<reason>",
        "operOnly": true
      },
      {
        "name": "RESV",
        "description": "Reserve",
        "usage": "RESV <nick|chan> [time] :<reason>",
        "operOnly": true
      },
      {
        "name": "TESTLINE",
        "description": "Test line",
        "usage": "TESTLINE <mask>",
        "operOnly": true
      }
    ],
    "extendedBans": []
  }
}
